{
  "standard_version": "1.0.0",
  "board_id": "TaishanPi",
  "variant_id": "1M-RK3566",
  "capability_id": "rgb_led",
  "request_text": "红灯心跳",
  "selected_backend": "sysfs_trigger",
  "mode": "heartbeat",
  "color": {
    "red": 255,
    "green": 0,
    "blue": 0
  },
  "timing": {
    "repeat": "infinite"
  },
  "deployment": {
    "transport": "ssh",
    "run_as": "root",
    "workdir": "/data/local/tmp/dbt/rgb_led"
  },
  "constraints": [
    "只在红灯通道写 trigger=heartbeat，其它通道保持 none。"
  ],
  "rationale": "heartbeat 是内核内置模式，不需要生成程序。"
}
